topic_key,name,svg_path,image_path,lottie_path,narration,explanation,fact,game_type,is_free,display_order
o,"{""en"": ""O"", ""gu"": ""O"", ""hi"": ""O""}",,/assets/images/alphabet/o.png,,"{""en"": ""O is for Orange! Oranges are round, sweet, and juicy citrus fruits."", ""gu"": ""ઓ એટલે ઓરેન્જ! નારંગી ગોળ, મીઠા અને રસદાર સાઇટ્રસ ફળો છે."", ""hi"": ""ओ से ऑरेंज! संतरे गोल, मीठे और रसीले खट्टे फल होते हैं।""}","{""en"": ""They are packed with Vitamin C, which helps keep you strong and healthy!"", ""gu"": ""તેઓ વિટામિન સી થી ભરપૂર હોય છે, જે તમને મજબૂત અને સ્વસ્થ રાખવામાં મદદ કરે છે!"", ""hi"": ""वे विटामिन सी से भरपूर होते हैं, जो आपको मजबूत और स्वस्थ रखने में मदद करता है!""}","{""en"": ""Did you know? Oranges are actually a hybrid of mandarins and pomelos, created long ago!"", ""gu"": ""શું તમે જાણો છો? નારંગી વાસ્તવમાં મેન્ડરિન અને પોમેલોની સંકર પ્રજાતિ છે, જે લાંબા સમય પહેલા બનાવાઈ હતી!"", ""hi"": ""क्या आपको पता है? संतरे वास्तव में मंदारिन और चकोतरा की संकर नस्ल हैं, जो बहुत पहले बनाई गई थी!""}",memory,true,15
p,"{""en"": ""P"", ""gu"": ""P"", ""hi"": ""P""}",,/assets/images/alphabet/p.png,,"{""en"": ""P is for Panda! Pandas are cute, fluffy bears with black and white fur."", ""gu"": ""પી એટલે પાન્ડા! પાન્ડા કાળી અને સફેદ રુવાંટીવાળા સુંદર, રુંવાટીદાર રીંછ છે."", ""hi"": ""पी से पैंडा! पैंडा काले और सफेद बालों वाले प्यारे, रोएंदार भालू होते हैं।""}","{""en"": ""Pandas love to eat bamboo all day. They live in cool forests in the mountains and are very good at climbing trees!"", ""gu"": ""પાન્ડાને આખો દિવસ વાંસ ખાવાનું ખૂબ ગમે છે. તેઓ પર્વતોના ઠંડા જંગલોમાં રહે છે અને ઝાડ પર ચઢવામાં ખૂબ કુશળ હોય છે!"", ""hi"": ""पैंडा को सारा दिन बांस खाना बहुत पसंद है। वे पहाड़ों के ठंडे जंगलों में रहते हैं और पेड़ों पर चढ़ने में बहुत कुशल होते हैं!""}","{""en"": ""Did you know? A giant panda spends about 12 hours a day eating bamboo to get enough energy!"", ""gu"": ""શું તમે જાણો છો? એક વિશાળ પાન્ડા પૂરતી ઊર્જા મેળવવા માટે દિવસમાં લગભગ ૧૨ કલાક વાંસ ખાવામાં વિતાવે છે!"", ""hi"": ""क्या आपको पता है? एक विशाल पैंडा पर्याप्त ऊर्जा प्राप्त करने के लिए दिन में लगभग 12 घंटे बांस खाने में बिताता है!""}",memory,true,16
q,"{""en"": ""Q"", ""gu"": ""Q"", ""hi"": ""Q""}",,/assets/images/alphabet/q.png,,"{""en"": ""Q is for Queen! A queen is a female ruler of a royal kingdom."", ""gu"": ""ક્યુ એટલે ક્વીન! રાણી એ શાહી રાજ્યની સ્ત્રી શાસક છે."", ""hi"": ""क्यू से क्वीन! रानी एक शाही साम्राज्य की महिला शासक होती है।""}","{""en"": ""Queens wear beautiful golden crowns and live in historic castles!"", ""gu"": ""રાણીઓ સુંદર સોનાના મુગટ પહેરે છે અને ઐતિહાસિક કિલ્લાઓમાં રહે છે!"", ""hi"": ""रानियां सुंदर सोने के मुकुट पहनती हैं और ऐतिहासिक महलों में रहती हैं!""}","{""en"": ""Did you know? Queen Elizabeth the Second was the longest-reigning queen in world history!"", ""gu"": ""શું તમે જાણો છો? રાણી એલિઝાબેથ દ્વિતીય વિશ્વના ઇતિહાસમાં સૌથી લાંબો સમય શાસન કરનાર રાણી હતા!"", ""hi"": ""क्या आपको पता है? रानी एलिजाबेथ द्वितीय विश्व इतिहास में सबसे लंबे समय तक शासन करने वाली रानी थीं!""}",memory,true,17
r,"{""en"": ""R"", ""gu"": ""R"", ""hi"": ""R""}",,/assets/images/alphabet/r.png,,"{""en"": ""R is for Rabbit! Rabbits are small animals with long ears and fluffy tails."", ""gu"": ""આર એટલે સસલું! સસલા એ લાંબા કાન અને રુંવાટીદાર પૂંછડીવાળા નાના પ્રાણીઓ છે."", ""hi"": ""आर से खरगोश! खरगोश लंबे कान और रोएंदार पूंछ वाले छोटे जानवर होते हैं।""}","{""en"": ""Rabbits hop around on their strong legs and love to munch on green grass, leaves, and carrots!"", ""gu"": ""સસલા તેમના મજબૂત પગ પર કૂદકા મારે છે અને લીલું ઘાસ, પાંદડા અને ગાજર ખાવાનું પસંદ કરે છે!"", ""hi"": ""खरगोश अपने मजबूत पैरों पर कूदते हैं और हरी घास, पत्तियां और गाजर चबाना पसंद करते हैं!""}","{""en"": ""Did you know? A rabbit's ears can grow up to 4 inches long and can rotate 270 degrees to hear sounds!"", ""gu"": ""શું તમે જાણો છો? સસલાના કાન ૪ ઇંચ સુધી લાંબા થઈ શકે છે અને અવાજ સાંભળવા માટે ૨૭૦ ડિગ્રી ફરી શકે છે!"", ""hi"": ""क्या आपको पता है? खरगोश के कान 4 इंच तक लंबे हो सकते हैं और आवाज़ सुनने के लिए 270 डिग्री घूम सकते हैं!""}",memory,true,18
s,"{""en"": ""S"", ""gu"": ""S"", ""hi"": ""S""}",,/assets/images/alphabet/s.png,,"{""en"": ""S is for Squirrel! Squirrels are small, furry animals with bushy tails."", ""gu"": ""એસ એટલે ખિસકોલી! ખિસકોલી એ રુંવાટીદાર પૂંછડીવાળા નાના પ્રાણીઓ છે."", ""hi"": ""एस से गिलहरी! गिलहरी झाड़ीदार पूंछ वाले छोटे, प्यारे जानवर होते हैं।""}","{""en"": ""Squirrels climb trees very fast, gather nuts and acorns, and bury them in the ground to eat later!"", ""gu"": ""ખિસકોલીઓ ખૂબ જ ઝડપથી ઝાડ પર ચઢી જાય છે, નટ્સ અને એકોર્ન એકઠા કરે છે અને પછીથી ખાવા માટે જમીનમાં દાટી દે છે!"", ""hi"": ""गिलहरियां बहुत तेजी से पेड़ों पर चढ़ती हैं, नट्स और बलूत के फल इकट्ठा करती हैं, और बाद में खाने के लिए उन्हें जमीन में गाड़ देती हैं!""}","{""en"": ""Did you know? Squirrels plant millions of trees because they forget where they hid their acorns!"", ""gu"": ""શું તમે જાણો છો? ખિસકોલીઓ લાખો વૃક્ષો વાવે છે કારણ કે તેઓ ભૂલી જાય છે કે તેમણે તેમના એકોર્ન ક્યાં છુપાવ્યા હતા!"", ""hi"": ""क्या आपको पता है? गिलहरियां लाखों पेड़ लगाती हैं क्योंकि वे भूल जाती हैं कि उन्होंने अपने बलूत के फल कहाँ छुपाए थे!""}",memory,true,19
t,"{""en"": ""T"", ""gu"": ""T"", ""hi"": ""T""}",,/assets/images/alphabet/t.png,,"{""en"": ""T is for Tiger! Tigers are large, wild cats with orange fur and black stripes."", ""gu"": ""ટી એટલે વાઘ! વાઘ સોનેરી-નારંગી રુવાંટી અને કાળી પટ્ટીઓ ધરાવતી મોટી જંગલી બિલાડીઓ છે."", ""hi"": ""टी से बाघ! बाघ नारंगी बालों और काली धारियों वाली बड़ी, जंगली बिल्लियां हैं।""}","{""en"": ""Tigers are strong hunters that live in jungles and grasslands. They love water and are excellent swimmers!"", ""gu"": ""વાઘ એ જંગલો અને ઘાસના મેદાનોમાં રહેતા મજબૂત શિકારી છે. તેમને પાણી ગમે છે અને તેઓ ઉત્કૃષ્ટ તરવૈયા છે!"", ""hi"": ""बाघ मजबूत शिकारी होते हैं जो जंगलों और घास के मैदानों में रहते हैं। उन्हें पानी पसंद होता है और वे बेहतरीन तैराक होते हैं!""}","{""en"": ""Did you know? Just like our fingerprints, no two tigers have the exact same pattern of stripes!"", ""gu"": ""શું તમે જાણો છો? આપણી ફિંગરપ્રિન્ટની જેમ જ, કોઈપણ બે વાઘ પર પટ્ટીઓની સમાન પેટર્ન હોતી નથી!"", ""hi"": ""क्या आपको पता है? हमारी उंगलियों के निशान की तरह ही, किन्हीं दो बाघों पर धारियों का एक जैसा पैटर्न नहीं होता है!""}",memory,true,20
u,"{""en"": ""U"", ""gu"": ""U"", ""hi"": ""U""}",,/assets/images/alphabet/u.png,,"{""en"": ""U is for Umbrella! Umbrellas keep us dry when it rains."", ""gu"": ""યુ એટલે અમબ્રેલા! છત્રી આપણને વરસાદ પડે ત્યારે સૂકા રાખે છે."", ""hi"": ""यू से अम्ब्रेला! छतरियां हमें बारिश होने पर सूखा रखती हैं।""}","{""en"": ""We open them over our heads to block the raindrops or shade us from the hot sun!"", ""gu"": ""આપણે વરસાદના ટીપાં રોકવા અથવા સૂર્યથી બચવા માટે તેને માથા પર ખોલીએ છીએ!"", ""hi"": ""हम बारिश की बूंदों को रोकने या धूप से बचने के लिए उन्हें अपने सिर के ऊपर खोलते हैं!""}","{""en"": ""Did you know? The word umbrella comes from the Latin word 'umbra', which means shade!"", ""gu"": ""શું તમે જાણો છો? અમ્બ્રેલા શબ્દ લેટિન શબ્દ 'umbra' પરથી આવ્યો છે, જેનો અર્થ છાંયડો થાય છે!"", ""hi"": ""क्या आपको पता है? अम्ब्रेला शब्द 'umbra' से आया है, जिसका अर्थ छाया होता है!""}",memory,true,21
v,"{""en"": ""V"", ""gu"": ""V"", ""hi"": ""V""}",,/assets/images/alphabet/v.png,,"{""en"": ""V is for Vegetables! Vegetables are healthy plants that we eat."", ""gu"": ""વી એટલે શાકભાજી! શાકભાજી એ પૌષ્ટિક છોડ છે જે આપણે ખાઈએ છીએ."", ""hi"": ""वी से सब्जियां! सब्जियां स्वास्थ्यवर्धक पौधे होते हैं जिन्हें हम खाते हैं।""}","{""en"": ""Vegetables like carrots, broccoli, and spinach give us vitamins and minerals to grow strong and healthy!"", ""gu"": ""ગાજર, બ્રોકોલી અને પાલક જેવી શાકભાજી આપણને મજબૂત અને સ્વસ્થ વધવા માટે વિટામિન્સ અને મિનરલ્સ આપે છે!"", ""hi"": ""गाजर, ब्रोकली और पालक जैसी सब्जियां हमें मजबूत और स्वस्थ बढ़ने के लिए विटामिन और खनिज देती हैं!""}","{""en"": ""Did you know? Tomatoes and pumpkins are scientifically fruits, but we cook and eat them as vegetables!"", ""gu"": ""શું તમે જાણો છો? ટામેટા અને કોળું વૈજ્ઞાનિક રીતે ફળો છે, પરંતુ આપણે તેને શાકભાજી તરીકે રાંધીને ખાઈએ છીએ!"", ""hi"": ""क्या आपको पता है? टमाटर और कद्दू वैज्ञानिक रूप से फल हैं, लेकिन हम उन्हें सब्जियों के रूप में पकाते और खाते हैं!""}",memory,true,22
w,"{""en"": ""W"", ""gu"": ""W"", ""hi"": ""W""}",,/assets/images/alphabet/w.png,,"{""en"": ""W is for Watermelon! Watermelons are large, sweet, and juicy summer fruits."", ""gu"": ""ડબલ્યુ એટલે વોટરમેલન! તરબૂચ મોટા, મીઠા અને રસદાર ઉનાળાના ફળો છે."", ""hi"": ""डब्ल्यू से वाटरमेलन! तरबूज गर्मियों के बड़े, मीठे और रसीले फल होते हैं।""}","{""en"": ""They have a green rind on the outside, and a sweet red inside with black seeds!"", ""gu"": ""તેમને બહારથી લીલી છાલ હોય છે, અને કાળા બીજ સાથે અંદરનો ભાગ મીઠો અને લાલ હોય છે!"", ""hi"": ""उनके बाहर एक हरा छिलका होता है, और काले बीजों के साथ अंदर का हिस्सा मीठा और लाल होता है!""}","{""en"": ""Did you know? Watermelons are 92 percent water, making them perfect for staying hydrated!"", ""gu"": ""શું તમે જાણો છો? તરબૂચમાં ૯૨ ટકા પાણી હોય છે, જે આપણને હાઇડ્રેટેડ રાખવા માટે શ્રેષ્ઠ બનાવે છે!"", ""hi"": ""क्या आपको पता है? तरबूज में 92 प्रतिशत पानी होता है, जो हमें हाइड्रेटेड रखने के लिए सबसे अच्छा है!""}",memory,true,23
x,"{""en"": ""X"", ""gu"": ""X"", ""hi"": ""X""}",,/assets/images/alphabet/x.png,,"{""en"": ""X is for Xylophone! A xylophone is a musical instrument with colorful bars."", ""gu"": ""એક્સ એટલે ઝાયલોફોન! ઝાયલોફોન એ રંગબેરંગી પટ્ટીઓ ધરાવતું સંગીતનું સાધન છે."", ""hi"": ""एक्स से ज़ायलोफ़ोन! ज़ायलोफ़ोन रंग-बिरंगी पट्टियों वाला एक संगीत वाद्ययंत्र है।""}","{""en"": ""We hit the bars with mallets to make bright, happy bell-like sounds!"", ""gu"": ""આપણે તેજસ્વી, ખુશ ઘંટ જેવા અવાજો કરવા માટે લાકડીઓથી પટ્ટીઓ પર પ્રહાર કરીએ છીએ!"", ""hi"": ""हम चमकीली, खुश घंटी जैसी आवाजें निकालने के लिए छड़ियों से पट्टियों पर प्रहार करते हैं!""}","{""en"": ""Did you know? The name xylophone comes from Greek words meaning 'wood sound'!"", ""gu"": ""શું તમે જાણો છો? ઝાયલોફોન નામ ગ્રીક શબ્દો પરથી આવ્યું છે જેનો અર્થ 'લાકડાનો અવાજ' થાય છે!"", ""hi"": ""क्या आपको पता है? ज़ायलोफ़ोन नाम ग्रीक शब्दों से आया है जिसका अर्थ 'लकड़ी की आवाज़' होता है!""}",memory,true,24
y,"{""en"": ""Y"", ""gu"": ""Y"", ""hi"": ""Y""}",,/assets/images/alphabet/y.png,,"{""en"": ""Y is for Yarn! Yarn is a long thread of wool used to make warm clothes."", ""gu"": ""વાય એટલે યાર્ન! યાર્ન એ ગરમ કપડાં બનાવવા માટે વપરાતો ઊનનો લાંબો દોરો છે."", ""hi"": ""वाई से ऊन! ऊन ऊन का एक लंबा धागा होता है जिसका उपयोग गर्म कपड़े बनाने के लिए किया जाता है।""}","{""en"": ""People use yarn with knitting needles to make cozy sweaters, soft hats, and colorful socks for winter!"", ""gu"": ""લોકો શિયાળા માટે આરામદાયક સ્વેટર, નરમ ટોપીઓ અને રંગબેરંગી મોજાં બનાવવા માટે ગૂંથણકામની સોય સાથે યાર્નનો ઉપયોગ કરે છે!"", ""hi"": ""लोग सर्दियों के लिए आरामदायक स्वेटर, मुलायम टोपी और रंग-बिरंगे मोज़े बनाने के लिए बुनाई की सुइयों के साथ ऊन का उपयोग करते हैं!""}","{""en"": ""Did you know? Yarn can be made from sheep wool, cotton plants, and even fluffy rabbit fur!"", ""gu"": ""શું તમે જાણો છો? યાર્ન ઘેટાના ઊન, કપાસના છોડ અને સસલાના નરમ રુવાંટીમાંથી પણ બનાવી શકાય છે!"", ""hi"": ""क्या आपको पता है? ऊन भेड़ के ऊन, कपास के पौधों और यहाँ तक कि खरगोश के मुलायम बालों से भी बनाया जा सकता है!""}",memory,true,25
z,"{""en"": ""Z"", ""gu"": ""Z"", ""hi"": ""Z""}",,/assets/images/alphabet/z.png,,"{""en"": ""Z is for Zebra! Zebras are wild horses with black and white stripes."", ""gu"": ""ઝેડ એટલે ઝીબ્રા! ઝીબ્રા કાળી અને સફેદ પટ્ટીઓવાળા જંગલી ઘોડા છે."", ""hi"": ""जेड से ज़ीब्रा! ज़ीब्रा काली और सफेद धारियों वाले जंगली घोड़े हैं।""}","{""en"": ""They live in herds in Africa and run very fast to escape predators like lions!"", ""gu"": ""તેઓ આફ્રિકામાં ટોળામાં રહે છે અને સિંહ જેવા શિકારીઓથી બચવા માટે ખૂબ જ ઝડપથી દોડે છે!"", ""hi"": ""वे अफ्रीका में झुंड में रहते हैं और शेर जैसे शिकारियों से बचने के लिए बहुत तेजी से दौड़ते हैं!""}","{""en"": ""Did you know? No two zebras have the same stripes! They are unique, just like fingerprints."", ""gu"": ""શું તમે જાણો છો? કોઈપણ બે ઝીબ્રા પર સમાન પટ્ટીઓ હોતી નથી! તેઓ ફિંગરપ્રિન્ટની જેમ જ અનન્ય છે."", ""hi"": ""क्या आपको पता है? किन्हीं दो ज़ीब्रा पर एक जैसी धारियां नहीं होती हैं! वे उंगलियों के निशान की तरह ही अद्वितीय हैं।""}",memory,true,26
